<?xml version="1.0" encoding="UTF-8"?>
<rutas xmlns:xsi="http://www.uniovi.es"
       xsi:noNamespaceSchemaLocation="rutas.xsd">

    <!-- RUTA 1: OLITE -->
    <ruta id="r1">

        <nombre>Ruta Medieval de Olite</nombre>
        <tipo>Histórica y monumental</tipo>
        <transporte>A pie</transporte>
        <fechaInicio opcional="si"></fechaInicio>
        <horaInicio opcional="si"></horaInicio>
        <duracion>3 horas</duracion>
        <agencia>NavarraTur</agencia>
        <descripcion>Recorrido por la ciudad medieval de Olite, antigua corte de los reyes de Navarra.</descripcion>
        <publico>Todos los públicos</publico>

        <inicio>
            <lugar>Olite</lugar>
            <direccion>Plaza Carlos III El Noble, Olite</direccion>
            <coordenadas>
                <longitud>-1.6496</longitud>
                <latitud>42.4815</latitud>
                <altitud>397</altitud>
            </coordenadas>
        </inicio>

        <recomendacion>9</recomendacion>

        <referencias>
            <referencia>https://es.wikipedia.org/wiki/Olite</referencia>
            <referencia>https://www.turismo.navarra.es</referencia>
            <referencia>https://www.castillodeolite.es</referencia>
        </referencias>

        <hitos>

            <hito>
                <nombre>Palacio Real de Olite</nombre>
                <descripcion>Palacio Real de los Reyes de Navarra, declarado Monumento Nacional en 1925.</descripcion>
                <coordenadas>
                    <longitud>-1.6496</longitud>
                    <latitud>42.4816</latitud>
                    <altitud>400</altitud>
                </coordenadas>
                <distancia unidades="m" anterior="0">0</distancia>
                <fotografias>
                    <fotografia>palacio_olite_1.jpg</fotografia>
                    <fotografia>palacio_olite_2.jpg</fotografia>
                </fotografias>
            </hito>

            <hito>
                <nombre>Iglesia de Santa María la Real</nombre>
                <descripcion>Iglesia gótica del siglo XIII con una de las portadas más importantes de la escultura gótica navarra.</descripcion>
                <coordenadas>
                    <longitud>-1.6501</longitud>
                    <latitud>42.4812</latitud>
                    <altitud>398</altitud>
                </coordenadas>
                <distancia unidades="m" anterior="60">60</distancia>
                <fotografias>
                    <fotografia>iglesia_santa_maria_1.jpg</fotografia>
                    <fotografia>iglesia_santa_maria_2.jpg</fotografia>
                </fotografias>
            </hito>

            <hito>
                <nombre>Plaza de los Teobaldos</nombre>
                <descripcion>Plaza histórica frente al Palacio Viejo, hoy Parador de Turismo.</descripcion>
                <coordenadas>
                    <longitud>-1.6503</longitud>
                    <latitud>42.4819</latitud>
                    <altitud>398</altitud>
                </coordenadas>
                <distancia unidades="m" anterior="80">80</distancia>
                <fotografias>
                    <fotografia>plaza_teobaldos.jpg</fotografia>
                </fotografias>
            </hito>

            <hito>
                <nombre>Iglesia de San Pedro</nombre>
                <descripcion>Iglesia románica con claustro y torre gótica rematada en aguja.</descripcion>
                <coordenadas>
                    <longitud>-1.6488</longitud>
                    <latitud>42.4820</latitud>
                    <altitud>399</altitud>
                </coordenadas>
                <distancia unidades="m" anterior="120">120</distancia>
                <fotografias>
                    <fotografia>iglesia_san_pedro.jpg</fotografia>
                </fotografias>
            </hito>

            <hito>
                <nombre>Murallas medievales</nombre>
                <descripcion>Restos defensivos del recinto amurallado medieval de Olite.</descripcion>
                <coordenadas>
                    <longitud>-1.6510</longitud>
                    <latitud>42.4808</latitud>
                    <altitud>395</altitud>
                </coordenadas>
                <distancia unidades="m" anterior="150">150</distancia>
                <fotografias>
                    <fotografia>murallas_olite_1.jpg</fotografia>
                    <fotografia>murallas_olite_2.jpg</fotografia>
                </fotografias>
            </hito>

        </hitos>

        <planimetria>planimetria_r1.kml</planimetria>
        <altimetria>altimetria_r1.svg</altimetria>

    </ruta>

    <!-- RUTA 2: SELVA DE IRATI -->
    <ruta id="r2">

        <nombre>Selva de Irati</nombre>
        <tipo>Paisajística y natural</tipo>
        <transporte>A pie</transporte>
        <fechaInicio opcional="si"></fechaInicio>
        <horaInicio opcional="si"></horaInicio>
        <duracion>5 horas</duracion>
        <agencia>Sin agencia</agencia>
        <descripcion>Uno de los bosques de hayas y abetos mejor conservados de Europa, con 17.195 hectáreas en los valles de Aezkoa y Salazar.</descripcion>
        <publico>Personas con buena forma física</publico>

        <inicio>
            <lugar>Orbaizeta</lugar>
            <direccion>Carretera NA-140, Valle de Aezkoa</direccion>
            <coordenadas>
                <longitud>-1.2270</longitud>
                <latitud>42.9700</latitud>
                <altitud>900</altitud>
            </coordenadas>
        </inicio>

        <recomendacion>10</recomendacion>

        <referencias>
            <referencia>https://es.wikipedia.org/wiki/Selva_de_Irati</referencia>
            <referencia>https://turismo.navarra.es</referencia>
            <referencia>https://www.irati.org</referencia>
        </referencias>

        <hitos>

            <hito>
                <nombre>Embalse de Irabia</nombre>
                <descripcion>Lago artificial construido en 1922, rodeado de hayedo-abetal. Punto de partida del recorrido circular.</descripcion>
                <coordenadas>
                    <longitud>-1.2190</longitud>
                    <latitud>42.9750</latitud>
                    <altitud>820</altitud>
                </coordenadas>
                <distancia unidades="m" anterior="0">0</distancia>
                <fotografias>
                    <fotografia>embalse_irabia_1.jpg</fotografia>
                    <fotografia>embalse_irabia_2.jpg</fotografia>
                </fotografias>
            </hito>

            <hito>
                <nombre>Fábrica de armas de Orbaizeta</nombre>
                <descripcion>Ruinas industriales del siglo XVIII, antigua fábrica de armas en plena selva.</descripcion>
                <coordenadas>
                    <longitud>-1.2350</longitud>
                    <latitud>42.9650</latitud>
                    <altitud>890</altitud>
                </coordenadas>
                <distancia unidades="m" anterior="400">400</distancia>
                <fotografias>
                    <fotografia>fabrica_orbaizeta_1.jpg</fotografia>
                    <fotografia>fabrica_orbaizeta_2.jpg</fotografia>
                </fotografias>
            </hito>

            <hito>
                <nombre>Hayedo central</nombre>
                <descripcion>Corazón del bosque de hayas centenario, segundo mayor hayedo-abetal de Europa.</descripcion>
                <coordenadas>
                    <longitud>-1.2100</longitud>
                    <latitud>42.9800</latitud>
                    <altitud>950</altitud>
                </coordenadas>
                <distancia unidades="m" anterior="500">500</distancia>
                <fotografias>
                    <fotografia>hayedo_irati.jpg</fotografia>
                </fotografias>
            </hito>

            <hito>
                <nombre>Mirador de Tapla</nombre>
                <descripcion>Vista panorámica del valle de Aezkoa y las cimas del Pirineo.</descripcion>
                <coordenadas>
                    <longitud>-1.2050</longitud>
                    <latitud>42.9820</latitud>
                    <altitud>980</altitud>
                </coordenadas>
                <distancia unidades="m" anterior="600">600</distancia>
                <fotografias>
                    <fotografia>mirador_tapla.jpg</fotografia>
                </fotografias>
            </hito>

            <hito>
                <nombre>Refugio forestal de Irati</nombre>
                <descripcion>Punto de descanso en la ruta, refugio de montaña en el interior del bosque.</descripcion>
                <coordenadas>
                    <longitud>-1.2000</longitud>
                    <latitud>42.9780</latitud>
                    <altitud>970</altitud>
                </coordenadas>
                <distancia unidades="m" anterior="300">300</distancia>
                <fotografias>
                    <fotografia>refugio_irati.jpg</fotografia>
                </fotografias>
            </hito>

        </hitos>

        <planimetria>planimetria_r2.kml</planimetria>
        <altimetria>altimetria_r2.svg</altimetria>

    </ruta>

    <!-- RUTA 3: BARDENAS REALES -->
    <ruta id="r3">

        <nombre>Bardenas Reales</nombre>
        <tipo>Paisajística / Semi-desierto</tipo>
        <transporte>Bicicleta</transporte>
        <fechaInicio opcional="si"></fechaInicio>
        <horaInicio opcional="si"></horaInicio>
        <duracion>4 horas</duracion>
        <agencia>NaturaTur</agencia>
        <descripcion>Parque natural semidesértico único en Europa, Reserva de la Biosfera de la UNESCO, con formaciones geológicas de arcilla, yesos y arenisca.</descripcion>
        <publico>Todos los públicos</publico>

        <inicio>
            <lugar>Arguedas</lugar>
            <direccion>Centro de visitantes de las Bardenas Reales, Arguedas</direccion>
            <coordenadas>